{
  "$schema": "https://osp.dev/schemas/provision-response.schema.json",
  "request_id": "req_01J8KR2B6M4XNWP8VDCF5GT7YH",
  "offering_id": "supabase/postgres",
  "tier_id": "free",
  "status": "active",
  "resource_id": "res_supabase_proj_abc123xyz",
  "credentials": {
    "encrypted_payload": "ZW5jcnlwdGVkX2NyZWRlbnRpYWxzX3BheWxvYWRfY29udGFpbmluZ19jb25uZWN0aW9uX3N0cmluZ19hcGlfdXJsX2Fub25fa2V5X3NlcnZpY2Vfcm9sZV9rZXlfand0X3NlY3JldF9hbGxfZW5jcnlwdGVkX3dpdGhfYWdlbnRfcHVibGljX2tleQ",
    "encryption_method": "x25519-xsalsa20-poly1305",
    "ephemeral_public_key": "ZXBoZW1lcmFsX3gyNTUxOV9wdWJsaWNfa2V5X2Zvci1kaWZmaWVfaGVsbG1hbg",
    "nonce": "ZW5jcnlwdGlvbl9ub25jZV8yNF9ieXRlcw",
    "provider_signature": "c3VwYWJhc2Vfc2lnbmF0dXJlX292ZXJfZW5jcnlwdGVkX3BheWxvYWRfZWQyNTUxOQ"
  },
  "fulfillment_proof": {
    "type": "health_check",
    "health_check_url": "https://abc123xyz.supabase.co/rest/v1/",
    "timestamp": "2026-03-27T14:30:45Z"
  },
  "region": "us-east-1",
  "created_at": "2026-03-27T14:30:00Z",
  "expires_at": null,
  "dashboard_url": "https://app.supabase.com/project/abc123xyz",
  "cost_estimate": {
    "monthly_estimate": "0.00",
    "currency": "USD",
    "breakdown": []
  },
  "trace_id": "4bf92f3577b34da6a3ce929d0e0e4736"
}
